{
  "top_label": "Beklenti",
  "top_emoji": "😎",
  "top_text": "\"Dizileri altyazısız izliyorum, İngilizcem hazır.\"",
  "bottom_label": "Gerçek",
  "bottom_emoji": "🫠",
  "bottom_text": "Garson \"Still or sparkling?\" deyince: \"Yes.\"",
  "lesson": "Anlamak ≠ konuşmak. Dinlemeyi **konuşma pratiğiyle** birleştir: her bölümden ==3 cümle== sesli tekrar et.",
  "meta": {
    "topic": "expectation vs reality: understanding vs speaking",
    "caption": "Beklenti: Dizileri altyazısız izliyorum, İngilizcem hazır 😎\nGerçek: Garson \"Still or sparkling?\" deyince \"Yes.\" 🫠\n\nAnlamak ≠ konuşmak. Dinlemeyi konuşma pratiğiyle birleştirmeden akıcılık gelmiyor. Her bölümden 3 cümleyi sesli tekrar et.\n\nSenin \"gerçek\" anın neydi? 😅 Yorumlara yaz 👇\nTag that friend 🔖\n\nUnderstanding English is not the same as speaking it.",
    "hashtags": ["#ingilizcememe", "#ingilizce", "#ahkakademi", "#learnenglish", "#englishmemes", "#ingilizceöğreniyorum", "#speakenglish", "#ielts", "#funnyenglish", "#dilöğrenme", "#englishhumor"],
    "audio_mood": "n/a (static post)"
  }
}
